{
  "schema_version": "asi_stack.manim_beat_plan.v2",
  "chapter_id": "confidential-and-verifiable-ai-computation",
  "teaching_promise": "The viewer can trace one protected inference from an explicit adversary and leakage model through a guarantee vector, compositional primitive choice, measured artifact, independent verification, stale-attestation failure, and a bounded handoff without mistaking an attestation or secure-compute label for semantic correctness or end-to-end privacy.",
  "target_duration_seconds": 313.18,
  "chapter_sha256": "25c4389bf52c0da42fb7271fe920a70b123e82db04ca2761625e660492558673",
  "source_commit": "f10ef079ecfeb48503407d67832a0251f77c2c78",
  "story": {
    "concrete_case": "A protected inference operation binds input, model, intermediate state, output, attestation, leakage, policy, freshness, cost, and recovery; a verifier checks a committed artifact while replay and wrong-model failures remain visible.",
    "opening_question": "What exactly does a protected-compute claim guarantee when users, providers, auditors, artifacts, and trust anchors do not share custody?",
    "payoff": "A compositional execution contract separates guarantee classes, names leakage and adversary scope, and admits only a bounded verified receipt.",
    "transfer": "Carry the protected-execution record into Model-Weight Custody and Hardware Roots of Trust, where weights, optimizer state, adapters, caches, and derivatives can be copied or reconstructed."
  },
  "art_direction": {
    "visual_thesis": "Confidential and verifiable AI is a compositional execution contract with explicit leakage, freshness, and verifier policy, not a single secure-compute badge.",
    "signature_image": "A dark protected-computation lab routes an input capsule and model vault through a guarantee matrix, compositional primitive rack, measured enclave, verifier, and fallback airlock.",
    "visual_world": "A trust-boundary control room with an execution contract, input capsule, model vault, guarantee matrix, primitive rack, attestation receipt, independent verifier, and fallback airlock.",
    "persistent_objects": ["execution contract", "input capsule", "model vault", "guarantee matrix", "attestation receipt", "independent verifier", "fallback airlock"],
    "composition_rule": "Keep user input left, model/provider custody right, execution contract above, guarantee matrix central, verifier and unsupported properties below, and the fallback airlock at the far edge.",
    "palette_rule": "Blue marks inputs and measured identity, amber marks contract and policy, violet marks cryptographic/computational protection, green marks an admitted guarantee, red marks leakage/failure, and gray marks unsupported scope; every color is labeled.",
    "typography_rule": "Use compact uppercase labels for adversary, asset, leakage, primitive, artifact, freshness, verifier, fallback, and semantic boundary; narration supplies the technical meaning.",
    "motion_character": "Assets register, guarantee rows separate, primitive paths compose, commitments bind, a verifier appraises a receipt, replay and wrong-model failures branch to quarantine, and a bounded handoff closes.",
    "camera_rule": "Open across distrust boundaries, tighten on guarantee separation and primitive composition, widen to artifact verification and failures, then return to the evidence ceiling and successor custody.",
    "surface_rule": "Every panel names an asset, adversary, leakage route, guarantee, primitive, artifact, policy, freshness, verifier, cost, fallback, or evidence boundary; semantic validity remains separate.",
    "ending_image": "A finite protected-execution receipt seals while a model-weight custody vault opens beyond the airlock."
  },
  "audio_direction": {
    "narration_style": "Concrete, calm, and guarantee-specific; the execution contract carries the causal arc.",
    "pacing_arc": "Open on distrust boundaries, separate guarantee classes, compose primitives, trace one measured operation and verifier, route stale/wrong-model failures, then narrow the evidence and hand off.",
    "duration_rationale": "The 05:13.180 runtime stays below the six-minute soft target while preserving guarantee, leakage, freshness, verifier, cost, and semantic-boundary distinctions; six minutes is a soft target, not a hard constraint.",
    "music_policy": "No music; capsule movement, matrix updates, and verifier/airlock changes carry the rhythm.",
    "sound_effect_policy": "No sound effects; labels, arrows, boundaries, crosses, and receipt stamps encode meaning.",
    "review_devices": ["normal-speed narration", "muted visual state", "audio-only comprehension", "captions-on timing", "phone-scale labels", "large-screen diagram", "random-frame continuity"]
  },
  "accessibility": {
    "color_redundancy": "Every guarantee and outcome uses labels, enclosure, position, arrow direction, line style, or crosses in addition to color.",
    "motion_redundancy": "Every primitive and failure settles into a named state; the guarantee matrix, verifier, and evidence boundary remain legible when motion is reduced.",
    "integrated_description": "The adjacent transcript names distrust roles, assets, guarantee vector, leakage, primitive composition, artifact commitments, freshness, verifier policy, failures, and evidence ceiling.",
    "caption_plan": "Use exact receipt-derived cues from the pinned 22-segment narration; the adjacent transcript describes each material state change.",
    "reduced_motion_assessment": "No flash, spin, shake, or continuous camera drift; guarantee and trust relations survive pause and reduced motion."
  },
  "beats": [
    {"id":"b01","story_function":"hook","start_seconds":0.0,"end_seconds":14.72,"narration":"AI inference crosses distrust boundaries: users may hide inputs, providers may protect weights, and auditors may need to verify an executed artifact.","sync_anchor":"crosses distrust boundaries","visual_purpose":"Open with the custody split among user, provider, and auditor.","visual_action":"Place an input capsule at the user edge, a model vault at the provider edge, and an auditor outside a dashed trust boundary around an execution core.","attention_target":"The three parties and the boundary between them.","semantic_encodings":["identity","relation","containment","authority"],"object_before":"Shared-custody assumption","object_after":"Separated distrust roles","continuity_objects":["input capsule","model vault","execution contract"],"composition":"User left, provider right, auditor below, execution core center.","motion_curve":"Progressive role reveal with settled boundary.","camera_action":"Widen from execution core to all distrust roles.","animation_techniques":["FadeIn","Create","LaggedStart"],"on_screen_text":["USER INPUTS","PROVIDER WEIGHTS","AUDITOR","DISTRUST BOUNDARY"],"settle_seconds":0.7,"hold_purpose":"Make custody separation the opening problem.","new_concepts":["distrust-boundary computation"],"claim_role":"question","evidence_boundary":"Role diagram; no confidentiality result."},
    {"id":"b02","story_function":"failure","start_seconds":14.72,"end_seconds":34.24,"narration":"Output integrity may be required without giving another party unrestricted custody. Transport encryption stops before computation begins, and ordinary privacy policy does not govern stored model artifacts.","sync_anchor":"Transport encryption stops before computation begins","visual_purpose":"Show where familiar protections stop.","visual_action":"Move an encrypted packet through a transport tunnel that ends before the execution core; show a privacy-policy card and model vault on opposite sides of an uncovered computation boundary.","attention_target":"The gap between encrypted transport and protected execution.","semantic_encodings":["contrast","sequence","containment","authority"],"object_before":"Transport protection","object_after":"Uncovered execution and custody gap","continuity_objects":["input capsule","model vault","execution contract"],"composition":"Transport tunnel left; computation boundary center; stored artifact right.","motion_curve":"Tunnel opens, then a hard stop.","camera_action":"Tighten on the uncovered compute interval.","animation_techniques":["Create","FadeIn","Cross","GrowArrow"],"on_screen_text":["ENCRYPTED TRANSPORT","COMPUTE BEGINS","PRIVACY POLICY","MODEL CUSTODY","GAP"],"settle_seconds":0.75,"hold_purpose":"Separate transport confidentiality from execution guarantees.","new_concepts":["execution-boundary gap"],"claim_role":"counterexample","evidence_boundary":"Boundary critique; no attack or privacy estimate."},